{"$schema":"https://json-schema.org/draft/2020-12/schema","title":"Oracle Lab Governance Amendment Context","type":"object","additionalProperties":false,"required":["schema_version","context_kind","generated_at","expires_at","bindings","review_import","reviews","disabled_capabilities","context_digest"],"properties":{"schema_version":{"const":1},"context_kind":{"const":"governance_amendment_context"},"generated_at":{"type":"string","format":"date-time"},"expires_at":{"type":"string","format":"date-time"},"bindings":{"$ref":"#/$defs/bindings"},"review_import":{"$ref":"#/$defs/artifact"},"reviews":{"type":"array","minItems":2,"maxItems":2,"items":{"$ref":"#/$defs/artifact"}},"disabled_capabilities":{"type":"array","minItems":12,"maxItems":12,"uniqueItems":true,"items":{"type":"string"}},"context_digest":{"$ref":"#/$defs/digest"}},"$defs":{"digest":{"type":"string","pattern":"^sha256:[0-9a-f]{64}$"},"artifact":{"type":"object","additionalProperties":false,"required":["path","digest"],"properties":{"path":{"type":"string","pattern":"^[A-Za-z0-9._/-]+$"},"digest":{"$ref":"#/$defs/digest"}}},"bindings":{"type":"object","additionalProperties":false,"required":["manifest","results","report","report_markdown","controller_report","controller_report_markdown"],"properties":{"manifest":{"$ref":"#/$defs/artifact"},"results":{"$ref":"#/$defs/artifact"},"report":{"$ref":"#/$defs/artifact"},"report_markdown":{"$ref":"#/$defs/artifact"},"controller_report":{"$ref":"#/$defs/artifact"},"controller_report_markdown":{"$ref":"#/$defs/artifact"}}}}}
