{"bindings":{"controller_report":{"digest":"sha256:63c58e58ae0a598fe34e729014458cfabd7cb0c6e479383d27cde9b01698f1f2","path":"docs/superpowers/evidence/p0-1/controller-final-report.json"},"controller_report_markdown":{"digest":"sha256:6ddbea63576a8ac1f7f5995c7ba6a88ac46b55653b1f68711de51444d3a00b6f","path":"docs/superpowers/evidence/p0-1/controller-final-report.md"},"manifest":{"digest":"sha256:8e168cc6491805940ef2ae057356db8f455aa55f88cef0fe4c160a9c01d185b9","path":"docs/superpowers/evidence/p0-1/p0-1-exit-baseline.json"},"report":{"digest":"sha256:ad59891de8b1cf09b5583a014629af17815c3f2bfc72e4589a9f10a62ec0a2b7","path":"docs/superpowers/evidence/p0-1/p0-1-exit-report.json"},"report_markdown":{"digest":"sha256:b69922ce2ee75f838c35dee7e44c52bc4693f45f0c20630bfe11cf79fafef965","path":"docs/superpowers/evidence/p0-1/p0-1-exit-report.md"},"results":{"digest":"sha256:56382adc3686dc926cb052f80adfb1379183412513b09f9f967111266436718a","path":"docs/superpowers/evidence/p0-1/p0-1-command-results.json"}},"context_digest":"sha256:23ecc19b28cd300db500689c28b99ecb47e7ae1cc7b1dce7106f3420807e7e27","context_kind":"governance_amendment_context","disabled_capabilities":["real_upstream_access","real_credentials","provider_internal_authority","profile_promotion","production_deployment","real_canary","direct_egress_trust","unverified_pinned_wire_claims","unsupported_negative_capabilities","expired_or_missing_negative_capabilities","unrestricted_capture","external_network_requests"],"expires_at":"2026-07-16T00:33:08.825Z","generated_at":"2026-07-15T00:33:08.825Z","review_import":{"digest":"sha256:c8849e572728ba66ce9cb73b73185130eab47160df48c7ac01b25cd75467e020","path":"docs/superpowers/evidence/p0-1/p0-1-review-import.json"},"reviews":[{"digest":"sha256:f3336bbe01b1a567c375ec12fdb4f05250ee1af518d10b7107564580d0eeb8b3","path":"docs/superpowers/evidence/p0-1/requirements-review.json"},{"digest":"sha256:1c068def53e9192a5d0fb74dccd1c732091aa90c7c2e5da5b2d739d87370dae8","path":"docs/superpowers/evidence/p0-1/security-quality-review.json"}],"schema_version":1}
